comment, label
"kita semangatin timnas kita .tetapi timnas selama saya lihat selama ini baru ada pederasi sebgus ini .sty juga bisa mengantarkan timnas kita hingga babak ketiga. tetapi federasi yang memiliki keputusan .kita harus optimis . insyaallah di gantinya pelatih timnas kita semoga lebih baik kedepannya.dukung federasi.tanpa ada federasi tidak akan sampai sejauh ini . indonesia raya .merdeka .", positive
"menurut kami warga negara setelah di latih kluivert justru menurun sekali tetapi sewaktu di latih sty permainan cantik dan pertahanan cukup kuat , makanya saya harap ini tetap sty", negative
"tidak ada pelatih yang bisa mengubah timnas indonesia dari minus dan hancur-hancuran dari peringkat yg memalukan hingga seperti sekarang menjadi tim yang baik dan membuat naik peringkat 125 fifa cuma sty dan ga akan pernah ada lagi pelatih yg bisa seperti sty. timnas akan kembali ke masa suram setelah di tinggal sty.", negative
"ini telah masuk politik, apapun organisasinya kalau ada di dalam pengurus, ada orang yang punya sifat tidak jujur,punya sifat iri dengki,pasti organisasinya bongkar pasang yang akhirnya menjadi mundur, saya yakin kalau di paksakan sty di ganti pasti timnas gagal,", negative
"jadi ingat pelatih inter milan jose mourinho pas keluar dari inter milan dan as roma walau keluarnya berbeda tapi intinya sty bakal tetap dikenang dalam sejarah timnas indonesia karena timnas sudah berkembang ditangan sty", positive
"pendapat pribadi saya. saya akan tetap mendukung timnas setara dengan penghormatan kepada simbol-simbol negara dan bangsa ini. namun demikian apakah kita akan selalu mampu bayar gaji pelatih yang udah ternama ? apakah kita akan selalu mampu bayar pemain tingkat a ? uangnya dari mana ? buat makan siang saja sudah nyusahin kepala. jika seandainya kita jadi juara dunia, apakah itu akan jadi titik balik ? pada akhirnya kita akan kembali memakai pemain-pemain kampung untuk merumput di lapangan", negative
"terus om mau sapapun pelatihnya sama aja, perkembangan bola digambarkan dari pemain lokal yang bersinar bukan hanya timnas", negative
"satu ajalah yang saya mau kita tunggu momennya kapan timnas bisa kalahkan arab saudi lagi selain ditangan sty. ditunggu pelatih selanjutnya salut saya jika ada pelatih selanjutnya di persahabatan ataupun resmi bisa seperti sty", positive
"faksi anti sty banyak tapi parahnya buta dia, ranking fifa indonesia sekarang udah melesat tajam naik semenjak kedatangan sty .", negative
"saya ikut pak erick karena dia benar-benar serius ingin memajukan timnas menjabat dua tahun kepemimpinan pak erick sudah membanggakan. mungkin sekarang ingin lebih tinggi. mending kita lihat aja kedepannya", positive
"pemecatan ini menyedihkan, saya merasa ada konflik internal dalam team, saya janggal ketika kapten tim jay idzes diganti ke asnawi yang banyak di cadangkan , padahal sama-sama main waktu itu.. dalaman timnas akhir-akhir ini memang tidak baik-baik saja antara pemain dan pelatih..", negative
"keputusan tepat dengan momentum yang ada", positive
"saya juga tidak setujum, sedih sekali, benar sekali sty sudah membawa kita ke mimpi yang bahkan kita tidak pernah bermimpi", negative
"kalo kita perhatikan, ada beberapa alasan sty dipecat taktik mentok, masih labil soal susunan pemain dan yang paling utama ya komunikasi. nah masuknya kluivert itu membantu ambisi rakyat indonesia untuk lolos ke piala dunia, karena dengan datangnya kluivert, bisa menarik lebih banyak minat pemain diaspora diluar sana untuk lebih cepat bergabung, itu sepertinya maksud pak erick. lagian stafnya juga hebat-hebat. semoga pencapaian timnas sesuai dengan harapan kita semua", positive
"sepakbola indonesia dagelan, sebelumnya tidak pernah ke fase ini. pelatih bagus dipecat. suka-suka pssi sajalah", negative
"udahlah. selain ketua umum, exco dan pemain timnas kita bisa apa cuma hanya bisa mendoakan yang terbaik untuk timnas", positive
"inilah contoh orang tua yang terlalu memaksakan, anaknya sedang merangkak disuruh langsung berlari. semoga timnas tetep konsisten dan tidak mengalami kemunduran lagi",negative
"sekarang siapa pun pelatihnya kalo kata pak et jangan pernah berhenti bermimpi menuju piala dunia", positive
"kita lihat aja hasilnya setelah pergantian pelatih, semua boleh beda presepsi",positive
"pelatih sty membawa indonesia meraih sesuatu yang sebelumnya mungkin hanya mimpi. tapi juga diingat, tanpa adanya pemain keturunan indonesia yang bermain di eropa, belum tentu bisa. jadi lebih baik dukung saja keputusan yang udah terjadi. pada akhirnya yang penting indonesia bisa masuk piala dunia. seorang et, saya rasa lebih mengerti ketimbang orang awam yang belum pernah memimpin klub kelas dunia..", positive
"ganti pelatih dari belanda karena kesalahan komunikasi, apa tidak lebih baik juga pssi nya dari belanda, agar mereka lebih paham dari bahasa belanda", negative
"saya dukung sty dan timnas. tapi pak erick thohir pemberi dukungan terbaik untuk mereka. tanpa dukungan pak erick thohir sangat mustahil sepakbola timnas bisa seperti sekarang ini. tetap kita dukung pak erick thohir dengan semua keputusannya. beliau yang paling tau permasalahan di tubuh timnas. dan kepada sty tetap terima kasih sebesar-besarnya atas semua jasa-jasanya kepada timnas dan rakyat indonesia pecinta sepakbola timnas.", positive
"susunan pemain lawan china dan hasil lawan China menurut saya itu yang jadi salah satu alasan pssi evaluasi. dari situlah menurut saya pssi melihat bukti bukti salah satunya di kalangan pemain di ruang ganti dan faktor faktor lainnya. menurut saya saja. apapun hormat dan terima kasih pelatih sty.", positive
"sampai ke ronde tiga itu penuh perjuangan, dari awal lawan brunei kandang and tandang, terus ronde dua lawan vietnam, philipina, irak, itu semua tidak instan", positive
"setuju pergantiannya itu tidak tepat kalo saat ini pssi memang terlalu mengambil resiko besar untuk mengganti sty saat ini, seharusnya pssi memberi keptusan di saat sudah kualifikasi piala dunia 2026", negative
"puncaknya piala aff, itu kesempatan terakhir sty, katanya tanpa target, faktanya itu adalah pilihan yang sulit untuk pak et, mau pilih pemain atau pilih pelatih", negative
"saya juga tidak terima alasan-alasan ini kenapa dari awal tidak di keluarkan? kenapa setelah indonesian jaya di tangan sty", negative
"sty sudah membawa kita ke mimpi yang bahkan kita tidak pernah bermimpi, deddy corbuzier", positive
"bagaimanapun sty sudah mengharumkan bangsa indonesia. jasa-jasanya sangat besar. jika ada salah maafkan beliau. masing-masing pelatih pasti punya kekurangan. mau dari manapun negaranya. yang sempurna hanyalah allah", positive
"saya pikir tepat pergantian pelatih ini, hanya saja yang menjadi pelatih seharusnya gus hiddink atau ruud gullit atau van gal atau frank rijkaard atau ronald koeman", positive
"dulu sty awal datang juga banyak yang meragukan dan menghujat, dan sampe akhirnya sekarang sty di puji-puji, sama hal nya degan pk, tapi semoga pk bisa berprestasi melebihi sty, pelatih bisa datang dan pergi, siapapun pelatihnya siapapun pemainnya jika mereka membawa merah putih terbang tinggi, wajib kita dukung", positive
"sty terbaik, namun untuk situasi sekarang butuh, pelatih yang berkomunikasi yang mengerti bahasa internasional dengan baik", positive
"masa cuman gara-gara sty tidak lancar bahasa indonesia jadi di pecat", negative
"kalo sempat indonesia kalah yang harus di hukum pak et", negative
"dengan ramainya komentar, pembicaraan mulai dari rumah-rumah sederhana, warung kopi, hotel berbintang, sampai ke jagad maya, itu menyatakan kita sangat mencintai timnas sepak bola, tetapi bagaimanapun perkembangan sepak bola saat ini tidak terlepas dari bung et, dan dia yang punya perencanaan kedepan, jadi kita harus mendukung apa pun tindakan yang diambil bung et. maju terus timnas kami. terbang tinggi garudaku bawalah nama indonesia sampai ke sudut-sudut bumi terjauh.", positive
"aku tidak peduli mau menang atau kalah. ganti pelatih atau ganti ketua pssi. yang penting aku seorang pendukung", positive
"bener sty memang tidak boleh digantikan", positive
"jika lebih merasa lebih pintar, coba saja atur timnas. seperti itu saja, supaya tidak jadi tong kosong nyaring bunyinya", negative
"kalau mau maju, harus berani ambil resiko. kita semua tau sepak terjang et di persepak bolaan. et tidak bakal ngambil keputusan asal asalan.", positive
"pasti ada alasan yang kenapa sty diberhentikan, saya percaya sudah ada evaluasinya setiap selesai pertadingan.", positive
"sampai saat ini sty bagus membawa timnas indonesia. coba pikir jika bahrain tidak curang soal penambahan waktu indonesia sudah di peringkat kedua. kalau soal pemecatan Sty dengan alasan komunikasi antara sty dan pemain menurut ku kurang tepat, karena saat ini timnas indonesia baik-baik saja dengan sty apa lagi kalau ga di curangi oleh bahrain indonesia sudah cukup baik di bimbing oleh sty.", negative
"bapak ketua umum erick thohir lebih mengerti dan memahami kebutuhan timnas saat ini dan pergantian pelatih sudah melalui keputusan yang matang, kami percaya ketua umum bapak erick thohir, demi kepentingan timnas di masa depan", positive
"apakah harus nunggu gagal baru ganti. atau ganti sekarang untuk menambah peluang lolos lebih besar. menurut saya keputusan pssi telah di pikirkan dengan matang", positive
"saya setuju sty dipecat, kasihan sty mengurusi orang-orang stres didalamnya.", negative
"saya yakin indonesia lolos piala dunia setelah ganti pelatih, saya percaya pak erick thohir bisa membawa indonesia lebih baik lagi. sty terlalu banyak rombak pemain. tidak ada pemain inti. tiap main pemilihan pemain berbeda. membingungkan", positive
"aku ikut tidak setuju sty diberhentikan saat ini. jadi bukan kalian bertiga saja yang tidak setuju. karena banyak pendukung yang tidak setuju juga.", negative
"saya selalu melewatkan berita pemecatan sty, sedih jika diingat, aku nonton timnas lagi karna pelatih sty, saya harap pelatih selanjutnya bisa meneruskan kebaikan untuk timnas, kalo bisa ya lebih baik", positive
"tanpa sty kita dapat menang,sty hanya datang disaat yang tepat yaitu di era nya et, jadi kita berkembang sampai sejauh ini ya karena dukungan pssi, sty hanya datang diwaktu yang tepat saja", negative
"saya pikir para petinggi pssi menganggap pemain kita ini sudah tinggi, karena banyak pemain bermain di luar negeri, jadi harus menang melawan cina dan bahrain, tetapi mereka melihat dahulu pemain kita ini pemain seperti apa, yang kita naturalisasi ini bukan pemain sekelah cr7, messi, mbape dll, yang emang sudah tidak bisa di omongin lagi, pemain kita banyak yang jadi pemain cadangan walaupun di bermain di eropa, ibaratnya ada bule masuk indonesia padahal di sana cuma tukang bawa kaleng cat nya trus di negara kita di jadi kan tukang cat profesional, perlu di ingat di grup kita tim terlemah secara rank fifa, sekarang dapat posisi 3 di grop sementara aja kita udah hebat sekali dengan pemain yang begini dengan pelatih yg begini, tetapi ya sudahlah mau panjang lebar juga percuma, inti nya semoga pelatih baru bisa bawa angin segar dan cepat beradaptasi dengan pemain dan bawa perubahan yang lebih baik lagi dan sesuai harapan semua masyrakat indonesia, untuk pelatih sty terima kasih banyak semoga sukses kedepan nya", negative
"pemain nasional indonesia saat ini banyak pemain naturalisasi yang berasal dari belanda. jadi mungkin itu alasan dipilih pelatih dari belanda. agar komunikasi lancar. kecocokan terbangun. rasa hormat lebih terbangun karena sesama asal belanda dari pemain dan pelatih. tapi saya tetap berterima kasih dengan sty karena telah membawa tim nasional indonesia disegani di dunia.", positive
"sudah tepat diganti menurut et, dan pengamat bola", positive
"mengganti bukan hanya saat gagal, bisa saat mencegah gagal atau ingin lebih baik. memang sangat ambisius pssi sekarang. sekarang bola panas ada di pssi bukan di sty lagi. sebegitu beraninya ambil resiko", positive
"maaf orang punya penilaian masing-masing tetapi menurut saya keputusan pak et untuk menganti pelatih itu tepat cuma masalah pengantinya pak pk yang belum meyakinkan.", negative
"pak et itu mengganti sty penuh pertimbangan. karir juga di pertaruhkan kok bisa rakyat indonesia tidak terima gimana. seharusnya lihat dulu hasilnya", positive
"aku salah satu orang yang bakal coba berhenti nonton timnas untuk sementara, tapi bukan karena aku mendukung timnas waktu berprestasi, tapi lebih ke memberi efek jera untuk federasi agar lebih berhati hati dalam mengambil keputusan, kalau kita terus terusan maafin dan cuman berbicara di sosmed tanpa kasih aksi yang berdampak, sampai kapan pun itu federasi akan terus terusan semena-mena dalam mengambil keputusan", negative
"pengalaman ataupun nama besar belum jaminan team akan berhasil. contoh roberto mancini di arab. kurang apalagi, itupun belum cocok jadi pelatih arab saudi. selain pengalaman, yang paling penting kecocokan dan keberuntungan dari pelatih ke tim yang bisa mengangkat sebuah tim", negative
"saya mendukung keputusan pak et, tapi tidak lupa juga jasa sty", positive
"kemarin aku menemukan komentar di instagram tentang masalah ini, inti dari komennya katanya orang-orang yang kontra dengan pemecatan sty cuman orang-orang yang fomo korea-koreaan, kenapa dari awal mereka mempekerjakan sty, berarti yang fomo orang-orang yang mempekerjakan?, terus setelah pertandingan-pertandingan kemaren kenapa tiba-tiba sty dipecat? apakah karena timnas sudah mulai dikenal di asia, mereka merekrut pelatih baru dari eropa karena ingin dikenal di eropa? berarti mereka merekrut pelatih cuman mencari kepopuleran? bukan prestasi bolanya?", negative
"patrick kluivert, saya sangat mencintaimu", positive
"pilihan baru tidak ada prestasi dikasih target tinggi, ingat yang instan akan ada efek samping, kalau sampai blunder kasih kartu merah, kalau main alibi membela diri tapi solusi minus, merusak ekpektasi pendukung yang ingin lebih baik dan berkembang malah retak dan hancur dari dalam karena ego", negative
"tetap dukung timnas, bukan pelatihnya, siapapun pelatihnya tetap timnas", positive
"setuju, yang tidak setuju hanya akan protes. tapi ketua pssi resikonya lebih besar. jadi percaya kan saja ke pak ketua umum. segala resiko lebih besar dipertaruhkan oleh pak ketua umum, yakinlah karena penonton sepak bola biasanya lebih pandai dari pemain bola.", positive
"terbang tinggi garudaku bentangkan sayapmu cakar semua lawan lawanmu", positive
"tinggal di dukung saja banyak kali cerita. indonesia bagaimana mau maju semua mau di ikut campurin", negative
"aku optimis indonesia masuk piala dunia", positive
"ada mafia yang ingin timnas indonesia tidak masuk piala dunia permainan dari dulu", negative
"kalau masih sty kalah dua match sty di hujat di pecat terus pildun harus nunggu empat tahun lagi? mungkin ini masih setengah-setengah tetapi erick thohir mengambil resiko itu", positive
"kita pendukung indonesia bukan sty, apapun keputusan federasi, kita hormati", positive
"ya masalah nya kalo tidak lolos kualifikasi harus menunggu lima tahun lagi", negative
"menurut saya ini sederhana sekali kalau di berhentikan berarti ada kesalahan fatal itu sudah di evaluasi jadi keputusan pak erick thohir sudah tepat dan ini untuk kemajuan sepak bola apalagi sty tidak bisa bahasa inggris dan indonesia menurut saya bahwa taktik dengan komunikasi harus lancar apa lagi pemain timnas sekarang jauh beda level", positive
"mungkin federasi bola kita ada bisikan maut", negative
"untuk menilai tepat atau tidaknya nanti bisa dilihat hasil pertandingan lawan australia dan bahrain", positive
"sebelumnya saya terima kasih kepada sty. dan saya mendukung keputusan pssi untuk pemberhentian sty", positive
"awalnya saya kecewa sty diberhentikan dan keputusan federasi yang mengambil pelatih kaya patrick kluivert yang cv-nya belum mentereng, tapi setelah saya mikir lagi. pemain-pemain timnas yang sekarang bagus banget dan di klub-klubnya juga, market valuenya juga tidak main-main. saya akan tetap dukung timnas dan pemain-pemainnya terus.", positive
"menurutku masalah memang di komunikasi antara sty federasi dan pemain, sampai elkan bagot di keluarkan sama sty", negative
"saya bukan pendukungnya individu pelatih sty, tapi memang agak kurang tepat jika ronde tiga masih belum selesai tapi sty dipecat, namun siapapun pelatihnya timnas indonesia semoga bisa membawa garuda lolos piala dunia 2026 dan nantinya garuda jadi langganan piala dunia", positive
"benar juga, semestinya pemberentihan sty itu sebaiknya habis masa kontraknya 2027, setelah itu baru pssi berhentikan artinya masa melatihnya dia berakhir, mungkin itu harapan pendukung timnas, sty adalah pelatih terbaik, bersejarah untuk indonesia kita harus akui itu", positive
"pada ngaco ganti pelatih kok tunggu gagal.", negative
"yang membuat sepakbola indonesia tidak maju-maju adalah federasi itu sendiri.", negative
"seandainya dengan pelatih sty gagal lolos piala dunia, saya bisa terima tapi kalo patrick sampai tidak bisa lolos ke piala dunia saya tidak terima akankah jadi blunder pak erick?", negative
"kan sudah di bilang ketua umum pssi lagi stres stadium lima", negative
"sty membawa indonesia dari nol sampe ke posisi tiga sementara di kualifikasi piala dunia. kita lihat kinerja kluivert dan pssi di akhir kualifikasi bagaimana. sisa empat pertandingan vs china dan bahrain (kandang), vs jepang dan australia (tandang). sangat mudah sekali, ibarat kata bola sudah dikirimkan dari belakang sampai ke kotak pinalti lawan, tinggal menunggu eksekusi", positive
"jika menurutku juga tidak tepat, tetapi itu lebih baik untuk sty dan apabila dalam kepelatihan sty tidak lolos lebih kasihan pasti banyak hujatan. Mungkin di balik pemecatan sty ada rencana tuhan yang lebih baik untuk sty, ya sudah semua itu sudah terjadi yang di ambil federasi pssi kita tetap dukung hanya waktu yang membuktikan akan lebih baik atau lebih buruk nanti kita tunggu saja", positive
"sty pasti berat melepas indonesia, karena dia mencintai indonesia", positive
"seharusnya diberi kesempatan sampai kualifikasi piala dunia habis bagaimana hasilnya. Jika emang tidak lolos tidak apa-apa di pecat. seperti ini saja, kita liat saja nnti mampu tidak lolos piala dunia jika lolos, ini merupakan hal yang baik, tepat keputusan pssi. tetapi jika gagal pssi harus bertanggung jawab", negative
"federasi terlalu ikut campur di ruang ganti. semua anggota pssi jangan suka masuk ruang ganti. biarkan itu urusan pelatih.", negative
"kalian harus tahu pak erick thohir sudah pengalaman dalam pegang klub bola, jadi kalian tinggal dukung saja", positive
"saya termasuk yang berpendapat penggantian Ssty bukan waktu yg tepat. mari lihat selanjutnya", negative
"setuju sty diganti", positive
"pssi memang anjing", negative
"kalau tak ada naturilisasi mau pelatih zidane pun juga kalah, jujur saja bisa terus menang juga pilih naturilisi yang sudah berpengalaman pilihan instan coba lima puluh persen atau seratus persen pemain lokal main mau pelatih gaji satu trilyun yakin apakah bisa lolos sejauh ini ?", negative
"sebenarnya ambisius besar itu ada di et. kenapa? karena sebelum dia jadi ketua umum kemajuan sty itu sudah mulai terlihat, andai saja iwan bule masih tetap memimpin pssi saya yakin tetap seperti ini sty kemajuannya. jadi et sekarang itu sangat ambisius dan et juga naturalisasi beberapa pemain dan akhirnya ada pro dan kontra, kemudian akhirnya sty yang dipojokan dari masalah ini. saya harap keputusan et ini harus dipertanggung jawabkan jika indonesia kembali ke zaman kegelapan lagi.", negative
"benar, setuju tidak setuju sty tetap tidak kembali", negative
"setuju tidak rela sty di keluarkan. tolong balik lagi", negative
"alah, bilang saja sty dipecat karena ada permainan dibelakang. ciri-ciri orang indonesia ya seperti ini, bisanya cuma komentar yang tidak ada isinya", negative
"kata pepatah "" habis manis sepah dibuang """, negative
"hanya sty yang bisa merubah timnas menjadi pemain internasional gaya bermain sudah gaya eropa", positive
"kita ngikut.aja ketua pssi. banyak berdebat tak menyelesaikan masalah", positive
"sudut pandangnya kluivert bisa tidak bawa timnas lolos ke piala dunia? kita tunggu sama-sama, baru komentar", positive
"bukan membela atau merendahkan siapapun. kita melihat secara objektif. harusnya dengan materi pemain diaspora minimal kita tidak kalah lawan cina dan imbang lawan bahrain kemarin", negative
"saya menikmatinya saja. jika timnas bisa lolos kualifikasi maka keputusannya tepat tetapi jika ternyata timnas hancur maka sudah jadi kebiasaan lama. politik!", negative
"masalahnya piala dunia empat tahun sekali makanya keputusan harus diambil secepatnya, karena jika sty gaya main monoton kemudian tidak lolos, harus menunggu empat tahun lagi. belum tentu pemain kita dimasa puncak seperti sekarang", positive
"yang membuang mu adalah pssi,bukan kami. pelatih sty, kami mencintaimu selamanya", positive
"sty datang saat persepakbolaan indonesia sedang kritis dan sekarat, sekarang sudah bangkit lebih baik. eh dipecat", negative
"pemain harus ikut apa yang di arahkan pelatih apabila pemain sampai mengadakan rapat sendiri itu sudah diluar jalur seorang pemain mereka sudah tidak layak jadi seorang pemain", negative
"yang membuat timnas sukses , ya mochamad iriawan (ketua umum pssi sebelumnya) dan tim pssi sebelumnya, sty dan tim pelatihnya dan erick tohir (ketua umum pssi sekarang) dengan timnya. tanpa masuk piala dunia pun, timnas sudah terbilang sukses. pelatih sty pulang dengan gagah dan sukses. kita hormat pada beliau.", positive
"kita lihat aja kualitas pelatih yang baru ini, jika tidak lebih pencapaiannya dari sebelumnya maka siap-siap terima hujatan dari netizen indonesia", negative
"saya akui sty membawa kita sampai sini, tetapi menurutku tepat evaluasi di lakukan, karena permainan sty parah dari arti kurang efektif, dari pergantian pemain, susunan pemain, taktik, semua tidak bisa di terima, apapun keputusan saya tetep dukung sekalipun hariono jadi pelatih timnas", positive
"ya, dipecat juga akhirnya", negative
"apapun komentarnya sudah tidak bisa merubah apapun. kita tinggal tunggu hasilnya aja. apa kita masuk piala dunia atau tidak.", positive
"kalau lawan australia dan bahrain kalah pelatih dan et harus mundur. biar mafia yang jadi ketua umum dan tidak perlu lagi kita berharap lagi. selesai", negative
"buang saja federasi nya banyak mafia di sana om", negative
"maunya pssi memilih si towel dijadikan pelatih timnas indonesia, pasti indonesia langsung juara piala dunia 2026", negative
"sejak dulu yang bermasalah bukan pelatihnya. tetapi kepengurusan pssi", negative
"setuju sekali karena piala dunia belum selesai, setelah piala dunia kalah bolehlah dievaluasi atau apalah. keuntungan dilatih orang korea itu pertama mereka terapkan kedisiplinan tegas, kalau ada yang bilang orang korea keras, hampir semua orang korea laki-laki dan perempuan tegas karena didikan dari negara mereka jadi tidak ada yang bisa mengintervensi mereka", positive
"kebiasaan bangsa ini tidak pernah ditinggalkan oleh pejabat publik yaitu merendahkan profesionalitas dan integritas seseorang dengan mempermalukan harga dirinya. jangan pernah menghina dedikasi orang yang tulus memberikan kemampuan terbaiknya. itu pelecehan moralitas dan sikap pengecut!", negative
"sty seorang yang rela menumbangkan negaranya sendiri demi timnas indonesia lalu di pecat begitu saja dia layaknya badut menghibur di banyak orang namun menagis di belakang layar karena dia tulus membelah lalu di di buang layaknya selembar kertas tak terpakai lagi", negative
"legawa sty memang harus diganti kalau Timnas senior lebih baik lebih tajam mainya lebih solid dalam satu Tim karena pemain pemain Turunan butuh kominikasi dan harus banyak konsultasi antara pemain dgn pelatih dan lolos piala dunia", positive
"menurut saya grafik sty sudah mencapai puncaknya, sekarang tinggal menurun. terbukti dengan keputusannya saat melawan china. kenapa dia tidak mau dikritik? sebagai pelatih handal, dia harus menerima kritik dari segala pihak termasuk pemain. kesalahannya diikuti menurunkan pemain junior di aff. jiwa superiornya meluntur. seharusnya dia mempertahankan ranking fifa-nya agar tetap stabil. dia tidak percaya kepada skuadnya yang siap bertanding. dan parahnya menjadi tertawaan tim lain.", negative
"oke semua sudah diputuskan, saya dsetuju sty tetap melatih. saya juga pecinta timnas. intinya buat saya timnas harus ke piala dunia. Jika pelatih pengganti gagal bawa timnas ke piala dunia baik lolos langsung atau lewat putaran 4 atau play off, pecat", negative
"yang bilang sty miskin taktik mungkin tidak nonton permainan anak-anak timnas u23 di piala asia kemaren. itu adalah bentuk permainan paling baik di era dia", positive
"sty bawa indonesia sejauh ini? ya karena berkat usaha serius saturalisasi dari bapak erick thohir. coba jika tetap pemain lokal yang di pertahankan sepertinya tidak akan sejauh ini kemajuan timnas.", negative
"akhirnya kekahawatiran itu benar terjadi kluivert gagal bawa timnas ke piala dunia. tanggung jawab kini di tangan federasi", negative
"baru nonton podcast ini di bulan oktober 2025, setelah timnas kalah dengan arab saudi dan irak dan tidak lolos piala dunia. patrick memasang pemain ketika melawan arab saudi dengan susunan yg ngawur.", negative
"timnas memang tetap timnas tapi malas lihatnya saya mau sty", negative
"saya juga sangat tidak setuju pergantian pelatihan di saat indonesia di titik sekarang.", negative
"keputusan sudah tepat, sty harus keluar sekarang, nanti terlambat", positive
"yang penting mainnya harus lebih solid lagi", positive
"tunggu aja bang hasilnya semisal hasilnya tidak memuaskan setelah laga australia dan bahrain. jika dua laga itu tidak memuaskan kembalikan sty dan wajib tanggung jawab", negative
"keputusan pak erick dengan memecat sty saya rasa patut kita dukung, dikarenakan kita butuh pelatih yang konsisten dengan pola permainannya dibandingkan yang pasang surut (timnas kita kadang bermain baik, kadang juga tidak)", positive
