comment, label
"aku ikut suara paling banyak, kalau banyak yang setuju pergantian sty sebagai pelatih, aku ikut kalian, kalau lebih banyak yg tidak setuju di ganti pk, aku lebih ikut kalian", positive
"terlepas alasannya pemecatan sty, itu pemilihan patrick yang dipertanyakan, bener apa ucapan bung valen", negative
"intinya pak et terlalu egois. di era nya indonesia pengen lolos piala dunia", negative
"pertanyaannya kalian mau nunggu sty pimpin sampai tidak lolos. kocak kalian", negative
"towel dan justin botak cs, mencari uang dari sosmed dengan cara menjelekkan sty. itu lah hebat nya sty, dari baru datang, sampai udah pulang, tetap bisa bikin orang-orang jadi populer dan punya banyak uang walaupun dengan cara menghina sty. mantap sty.", negative
"karena indonesia dihuni pemain naturalisasi orang belanda. hampir semua.. makanya erick tohir sudah merencanakan merekrut pelatih belanda agar tidak terkendala masalah bahasa. jadi bisa satu visi dan misi antara pelatih dan pemain.. masak tidak peka. itu isi sanubari erick tohir teman-teman", positive
"semoga pemecatan ini tepat, dan lolos piala dunia 2026, jika tidak tepat indonesia kena karma, tidak memanusiakan manusia, kanapa diperpanjang ujung-ujungnya dipecat, kan rugi, tidak masuk akal alasan semua", negative
"kami masih dukung indonesia dan pssi sekarang. tidak perlu di bahas tepat tidak tepatnya.", positive
"ingat kata gus dur dulu, kenapa timnas indonesia masih akan lama masuk ke piala dunia karena tidak punya kedisiplinan, tapi itu sudah dirubah oleh sty", positive
"untuk sty kita harus memberi apresiasi sebesar besarnya, tapi, yang awalnya kita berambisi 2030 masuk piala dunia, tapi selagi ada peluang yang 50:50 di 2026 ini ngapain kita nunggu sty keluar setelah kualifikasi piala dunia selesai dan tidak lolos. yang tadi nya jika kita berpeluang besar ketika 2026 ini kita sia-sia kan belum tentu kita 2030 masuk piala dunia apalagi tetangga kita yang lain juga sudah berambisi melihat perkembangan kita. tetap pak erik tohir terbaik. untuk sty tetap hormat dan berterima kasih", positive
"saya setuju sty diganti om ded", positive
"saatnya pssi di isi oleh mantan mantan pemain timnas garuda bukan orang politik. selama pssi di isi oleh orang politik selama itu juga sepak bola negara ini tidak berkembang. salam hormat netizen +62", negative
"jelas kenapa di ganti, karena di putaran ketiga main enam kali menang sekali", negative
"pssi terlalu berangan-angan dengan mengunakan pelatih eropa bisa menjamin jadi juara piala dunia. mereka lupa bahwa pernah jerman dan itali dipulangkan oleh jepang dan korea pada piala dunia beberapa tahun yang lalu.", negative
"hanya mengingatkan bahwa isu ruang ganti inilah yang selalu membawa belanda gagal di banyak ajang bergengsi. artinya kalau memang benar betul isu itu, maka saya lebih condong isu tersebut ada pada pemain-pemain belandanya. karena itu kebiasaan mereka. sesuai rekam jejak timnas belanda.", negative
"emang sty kurang. kalo bagus tidak mungkin di pecat", negative
"tidak pernah juara dibela. sty lebih baik dipecat. jika kluivert bisa kalahkan australia tolong video ini dihapus.", negative
"saya lebih rela sty dipecat dari pada kepala federasi nya yang mundur, luar biasa si pak erick berani ambil resiko demi ambisi dari pada main aman demi popularitas", positive
"luis milla di pecat setelah piala asia, sty di pecat setelah piala aff, bisa aja pk ini di pecat setelah gagal piala merdeka malaysia", negative
"teman-teman, sadar yang bawa sepak bola indonesia sampai level ini adalah berkat pak erick beserta jajaranya. bukan yg lain jika kalian sadar pelatih silih berganti datang melatih indonesia tapi hasil nya apa sepak bola indonesia tetep itu itu aja. pak erick pemilik inter milan dan lain-lain, media malaysia saja sempet singgung bukan pemainya indonesia yang di takuti tapi pak erick sendiri. kalian ingat thailand yang sepak bola nya terbaik di asean kagum hingga madam phang sendiri datang ke indonesia ingin bertemu pak erick. argentina sendiri datang berkat siapa pak erick dan jajaran nya pemail keturunan datang berkat siapa pak erick dan jajaran nya. sudalah kita percayakan saja semua pada pak erick apapun hasil nya dukung pak erick karena beliau yg bekerja keras hingga indonesia di level ini.", positive
"sty diganti karena hanya mempunyai pengalaman di wilayah asia, kalau kluivert sudah memiliki jam terbang terkait sepakbola dunia ( Piala Dunia ) jadi berpirikan positif saja, indonesia ingin masuk piala dunia sesuai harapan gus dur pada pernyatannya di Tahun 2004-2008",positive
"masih tidak ikhlas sty dipecat", negative
"jika indonesia dua kali tanding kalah maka ketua pengurus pssi harus mundur", negative
"jika saya mau siapa pelatih nya yang penting timnas tetap solid, lucu kalian semua yang menilai berlebihan. seperti bisa saja kalo di kasih emban sebagai pelatih. hanya pandai berbicara saja, garuda di dadaku", positive
"jika sampai indonesia tidak lolos piala dunia, exco pssi keluar saja kalian semua.", negative
"yang bikin rusak itu pendukung. sejak kapan pelatih berkelas atau menuju berkelas mengikuti maunya pendukung agar klubnya maju? si jebret bilang sebelum ke masalah teknis mampu tidak memenangkang hati masyarakat indonesia? ayolah, dari awal kan kita sepakat timnas mau gimana pun tetap di support. jadi ketika ada pelatih baru atau siapapun yang baru harusnya tidak peduli pro kontra, lanjut perbaikan teknis taktik dan sebagainya yang bisa dikendalikan oleh pelatih itu sendiri. kelamaan kita ngurusin yang kontra, tidak ada waktu, seiring waktu kalau nanti berhasil dan berprestasi, yang kontra akan bungkam. omong kosong jika mendukung tapi bikin rumit harus sesuai keinginan pendukung.", positive
"inilah waktunya pak erick bakalan jadi kelimpungan, patrick kluivert jadi tumpuan satu-satunya penyelamat! pelatih ini masih belum truji seperti sty.", negative
"opini saya patrick pada dasarnya penjudi yakin ini buat jadi pelatih timnas yang notabene mafia bolanya barbar bisa jadi kan dia gampang disuap dan akhrinya timnas kita malah terpuruk lagi", negative
"sebelumnya terima kasih sty, dan saya percaya pak et, beliau ingin meningkatkan probabilitas timnas lolos pildun, dia kawakan di industri olahraga, timbang kemakan analis pundit-pundit tidak jelas. analisa koci terbaik.", positive
"skenario mafia bola di indonesia. sty di lengser. ganti pelatih baru, timnas kalah yang di salahin pasti pak erick thohir. pak et di lengser mafia bola mulai menguasai kembali di dunia sepak bola indonesia. selesai", negative
"mimpi atau mimpi yang tidak mungkin jangan terlalu larut dengan sty. sty tidak melahirkan sepakbola indonesia maju.", negative
"dari hasilnya kalah kok gitu ya, ternyata indra sjafri juga ikut terlibat cuman lewat saja tidak pernah dievaluasi, begitu kalah dua kali sekarang ada yang nyeletuk harus mundur panik semua nya,", negative
"erick thohir ganti pelatih udah tepat.", positive
"erick thohir patut di curigai", negative
"menurut saya sty mundur tepat. mencari pelatih itu mudah, mencari kketua umum federasi itu yang sulit", positive
"seperti ini, pak erick itu sudah berkorban banyak untuk mendatangkan pemain diaspora, kemungkinan sty di copot ya gara-gara pribadi pemain ke sty bukan karna taktik, padahal secara permainan pemain diaspora tidak diragukan lagi, tau kan kekhawatiran pak erick jika pertandingan kedepan keulang lagi seperti tandang di cina kemarin. hanya sebatas opini saya, terlapas dari itu tugas kita cuma dukung timnas, mau kalah mau menang tetep dukung!!", positive
"pada akhirnya jika patrick tidak bisa membawa timnas lebih baik ya erick thohir pasti mundur. dan timnas kita balik lagi ke jaman dulu lagi. balik kocar kacir lagi", negative
"korea bagus bukan cuma karena sty buktinya ganti pelatih saja tetap bagus, pemain juga punya peran penting lah jangan cuma sty yang di anggap berjasa", negative
"sudahlah, jangan terlalu mendewakan sty, saya juga sedih tapi mau bagaimana lagi, semakin lama juga semakin diktator", positive
"keputusan fatal pssi pecat sty", negative
"saya salah satu pendukung timnas indonesia yang sangat kecewa dengan keputusan pemecatan sty", negative
"federasi psikopat emang, mencari pelatih yang bisa dimanipulasi. seperti ini mana pemuja pemuja pak erick, yang percaya sama omongan-omongan di pers soal pemecatan sty, omong kosong! pak erick tidak berdaulat masih kalah sama orang-orang di sekitarnya yang sangat kuat dan korup", negative
"intinya erick thohir tidak mau indonesia ketika bermain hanya bertahan terus, erick thohir ingin indonesia disegani dunia", positive
"sty tetap yang terbaik sepanjang masa. target pssi harus lolos piala dunia kita liat saja", positive
"benar yang paling pas itu giovanni van bronckhorst, agak aneh memang kok bisa ke pikiran ke pk, kocak sih,segitu banyaknya pelatih belanda yang tersedia milihnya yang seperti ini, atau kalau mau putra bangsa sendirilah, konoha emang aneh", negative
"percaya aja sama pak erick thohir yang sudah jelas kontribusinya buat timnas, tenaga, pikiran, dana pribadi ratusan milyar, jadi jangan pada banyak bacot lah, sebelum ngomong sama diri sendiri ""apa yang sudah aku berikan buat timnas? "" paham tidak!", positive
"nggapain juga nonton timnas kalau tidak bagus, bodoh, menyakiti hati sendiri, merusak kebahagiaan", negative
"haha menang lawan arab saudi juga sty tidak di ajak di ruang ganti. inisiatif pemain diaspora alhasil menang lawan arab saudi", negative
"kalau saya benar, karena ego sty kita kalah dengan china, yang harusnya seri atau menang, hanya karena tidak mau diskusi atau dikritik dia tidak turunkan pemain terbaik, harusnya singkirkan ego demi profesionalitas, demi rakyat indonesia, demi yang berkomentar sekarang ini,", negative
"jika tidak lolos ke piala dunia, saya pensiun nonton bola indonesia", negative
"intinya federasi ragu kalau sty bisa membawa garuda ikut di olimpiade padahal jelas-jelas itu bukan target sty di perjanjian. jadi ambisi federasi sendiri yang butuh target olimpiade tercapai. ya tidak masalah, hanya saja gegabah memecat sty. main kasar itu.", negative
"saya setuju sty di ganti. bukan berarti saya tidak suka sama sty, saya apresiasi perjuangan sty yang telah membangun timnas. tetapi masalahnya ekspektasi kita lebih dari ini. dengan pemain-pemain yang di besarkan dalam budaya sepak bola eropa, saya yakin pemain-pemain ini butuh sosok pelatih yang benar-benar bisa mengerti permainan ala eropa. keputusan mengganti sty dengan pelatih eropa menurut saya sudah tepat.", positive
"kalo semisalnya pelatih sty di pecat gara-gara kuarangnya komunikasi dengan pemain karena pemahaman bahasa, kenapa tidak menggunakan penerjemah yang sangat kompeten ?, meskipun sedikit repot tapi setidaknya tidak lebih merepotkan dari pada harus mengganti pelatih dan membangun kecocokan dari nol.", negative
"kasih kesempatan? kasih kesempatan tuh di liga atau klub level bawah, kalau minta kesempatan di waktu krusial gini kocak, tahurannya lolos atau tidak lolos kualifikasi piala dunia putaran 3, bagaimana sih. ini kasusnya seperti gibran minta kesempatan jadi wakil presiden. memang orang kita tidak pernah belajar dari masa lalu",negative
"sty bagus tapi egois,sampai bang jay di copot ban kapten saat melawan cina,tidak mau kritikan para pemain timnas. elkan baggot aja tidak di panggil lagi ke timnas karena keegoisan sty.", negative
"saya sependapat dengan pssi. secara logika saja, kita percaya pak erick bawa pssi semakin maju, jadi kenapa tidak percaya jika harus ganti pelatih ? kita hanya beruntung masuk putaran ketiga piala dunia, bukan bermain bagus ya. jadi perlu di coba yang baru. coba kita lihat waktu melawan cina, sejak saat itu saya mulai curiga dengn sty", negative
"sampai saat ini 21 agustus 2025 sty belum tau pasti apa alasanya beliau di pecat dari timnas indonesia, dan juga pssi tidak memberi alesan apapun tentang itu, dan pelatih sty mengungkapkan semuanya itu di podcastnya bang jeje, beliau merasa di fitnah oleh salah satu exco pssi tentang komunikasi pelatih dengan pemain tetapi menurut pelatih Sty itu baik-baik saja hingga saat ini masih berkomunikasi dengan pemain meskipun lewat pesan pribadi, wa tetapi komunikasi dengan erick thohir sudah putus komunikasi sejak pemecatan itu .", negative
"jika ganti sty kita sudah benar-benar tidak masuk piala dunia. tidak ada guna nya lagi bro. karena mimpi kita mau main di piala dunia 2026 tidak ada lagi", negative
"inilah alasan indonesia sampai kapan juga tidak bakalan maju, baru ada kemajuan dikit indonesia langsung ada huru hara. tidak bisa mempertahankan orang cerdas , malah di pecat. hadeh kesel jadinya.", negative
"saya sih dari awal tidak setuju. mungkin karena saya terlalu nasionalis. jadi dari para pemain saja sudah tidak setuju saya. saya lebih bangga jika anak bangsa yang jadi pemain, tanpa naturalisasi", negative
"jaganlah kalian menjelekan pak erick kalian tau tidak kalau sty tidak di pecat diaspora bubar saya ini megikuti pssi ini dari kurniawan masih di salatiga. tidak ada ketum pssi sehebat erick", positive
"saya mencium bau kepentingan pribadi untuk politik ketika sty di pecat saya lebih berharap indonesia gagal ke piala dunia.", negative
"jadi begini, kenapa di pecat sekarang kan dari erick thohir sudah jelas jika setelah lawan cina waktunya terlalu mepet. kesalahan lawan cina juga masih di lakuin sty ketika aff kemarin, jadi mungkin sty tidak mau berubah dan masih kekeh sama konsep sty sendiri, dari pihak pssi takutnya empat sisa pertandingan sty masih bereksperimen yang mengakibatkan kerugian untuk timnas", positive
"sekarang mari kita buktikan patrick kluivert harus bisa menang lawan australia di australia minimal imbang itu sudah bisa membuktikan pergantian sty sangat tepat dan harus menang lawan bahrain di jakarta gbk", positive
"Akui saja zaman pssi nya erick thohir lebih bagus dalam segala hal daripada pssi pendahulunya", positive
"saya lebih percaya erick thohir daripada orang orang ini. erick thohir lebih ngerti daleman timnas dibanding mereka bertiga. saya juga lebih percaya erick thohir dengan segala visi-nya untuk sepak bola indonesia", positive
"pencetak sejarah indonesia di ranah sepakbola yang sesungguhnya (sty)", positive
"terima kasih, sty atas jasa jasa kepada timnas indonesia", positive
"sty akan selalu di kenang sepanjang masa oleh pecinta sepak bola indonesia. terima kasih pelatih sty, kami mencintaimu", positive
"terima kasih sty atas dedikasimu terhadap timnas di negeri ini sudah menjadi baik berkat engkau jadi seperti ini. bahkan sampai membawa timnas di putaran ketiga kualifikasi piala dunia 2026. bahkan beliau sudah melatih indonesia tapi kenangan bersama timnas indonesia tidak pernah hilang dari benak pendukung maupun masyarakat negeri ini sekali terima kasih pelatih sty sudah setulus itu melatih timnas kita", positive
"kami selalu pecinta timnas akan selalu mendukung pelatih sty dimana pun berada, karena walau bagaimana pun dia telah membawa timnas indonesia ini menjadi lebih baik di peringkat fifa dunia. terima kasih pelatih sty semoga pengalaman yang pelatih berikan kepada timnas ini bisa mendongkrak ke setiap pemain", positive
"seumur hidupku baru sty pelatih terbaik timnas indonesia aku sungguh sangat suka gaya permainan sty karena dia tau cara bertahan dan menyerang sama-sama kuat maka dia mengedepankan fisik para pemain itu filosofi sepak bola yang sesungguhnya, dia patut di contoh oleh para pelatih yang lain", positive
"lima tahun walau tanpa trofi, tapi sty telah menciptakan sejarah baik dalam perjalanan sepak bola timnas indonesia menjadi salah satu kekuatan di asean bahkan asia, mengharumkan nama indonesia dengan timnas lolos kualifikasi piala asia 2023 dan piala asia u23 2024, serta untuk pertama kalinya timnas dibawah asuhan sty lolos kualifikasi piala dunia zona asia putaran ketiga.", positive
"kami pendukung tidak menaruh ekspektasi seratus persen lolos piala dunia dengan SSty karena kami percaya proses, tapi saat sty diganti artinya dari pssi sendiri yang suruh kami buat ekspektasi pasti lolos piala dunia karna mereka mau instan", negative
"memang semua ada risiko pak erick, perubahan juga ada risiko. tapi harusnya sebagai profesional lebih bisa menghitung probabilitas apalagi bapak di bidang bisnis yang banyak menggunakan probabliitas sudah sangat ahli. mending gagal sama yang berjuang dari awal pak daripada udah ganti pasangan tetap saja gagal", negative
"untuk para pemain timnas garuda terima kasih sudah berjuang sampai sejauh ini", positive
"terima kasih sty pernah memberi kami optimisme, pernah memberi sedikit harapan, pernah memberi kami penghiburan ditengah keputusasaan sepak bola negara kami", positive
"keinget dahulu ketika sty yang menjadi pelatih ,pasti semangat sekali nontonnya. sekarang zaman malas nonton indonesia kembali datang", negative
"apapun pertanggungjawaban yang dilakukan pssi terutama erick thohir setelah ini, mau minta maaf atau tindakan apapun itu tidak akan bisa mengobati pendukung timnas.", negative
"kluivert itu hanya bagus menjadi pemain tidak untuk menjadi pelatih. saya sudah pesimis dari awal pergantian kepelatihan, dan ternyata kejadian kasus terburuk. pihak yang harus bertanggung jawab ya pssi!", negative
"kita masih bisa lihat piala asia bang, atau aff nanti. semangat buat kita yang mau lihat timnas kita maju", positive
"kalo menurut saya, sty itu sepertinya memang dijebak, soalnya waktu piala aff kemaren pssi mau sty pake squad u22 dan sty mau, disaat tidak menunjukkan peforma yang baik makanya PSSI seolah-olah evaluasi menurut hasil dari turnamen tersebut, padahal dari pssi nya emang tidak menargetkan ke aff, karena gagal itu dipecat, jadi menurut saya memang jebakan berdalih dinamika", negative
"selama federasi masih dilingkungan politik atau mafia, jangan berharap banyak. bagaimanapun juga kita wajib dukung timnas tapi jangan berharap prestasi, anggap aja hiburan semata.", negative
"terima kasih banget kepada pemain yang telah berjuang bahkan dari awal lawan brunei sampai sekarang, banyak pergantian pemain keluar masuk demi meningkatkan kualitas dan meningkatkan prestasi tapi ada daya perjuangan harus kandas, dan sikap federasi harus bijak kalau gagal pecat, bukan malah di puji dan di lindungi dengan kata jangka panjang", positive
"sepak bola sudah terlalu di politisasi.", negative
"salah satu hiburan yang bisa dinikmati masyarakat masih aja masih digunain buat kepentingan politik. perjalanan dua tahun lebih sia-sia", negative
"sekalipun memang mau cari pengganti, setidaknya cari pelatih yang memang punya pengalaman di kompetisi asia, mengenal dengan baik kultur sepakbola asia, jangan cuma karena punya nama besar tapi portfolio nya tidak seberapa", negative
"mimpi kita dan para pemain musnah seketika, apa tidak ada simpati sama sekali?, saya juga setuju sama abang aelama timnas berjuang kita masih dapan hiburan di kehidupan yang keras ini, yang sudah sirna karena keputusan gegabah.", negative
"pemain-pemain ini luar biasa. mereka bisa ke piala dunia (sebenarnya). mereka sudah membuktikan di tangan pelatih yang tepat mereka bisa berjuang mengeluarkan potensi terbaik mereka dan menang. di tangan pelatih sekarang meraka juga berjuang luar biasa. tetapi apa yang ditakutkan akhirnya terjadi ketika pelatih yang baru (ternyata) lebih mengutamakan filosofi daripada hasil akhir. menempatkan gaya permainan menyerang sebagai prioritas dibandingkan mimpi 300 juta rakyat indonesia. pelatih yang dipilih federasi untuk menggantikan pelatih lama yang sudah terbukti bisa memaksimalkan potensi pemain sambil menjaga prioritas peluang timnas ke piala dunia.", negative
"pada intinya pergantian pelatih bukannya menjadi nilai positif malah negatif dari segi taktik ataupun permainan yang tidak stabil entah dari formasi serta susunan pemain yang sering konyol, padahal kualitas pemain kita lebih baik dari sebelumnya. sangat mampu bersaing untuk kelas asia untuk lolos piala dunia. permasalahan non teknis sepertinya sangat fatal ada aktor atau kelompok yang tidak ingin sepak bola indonesia maju terutama tim nasional nya.", negative
"sembilan puluh persen rakyat indonesia tidak setuju waktu sty dipecat dengan cara tidak hormat, padahal rekam jejak sty bagus, banyak pencapaian-pencapaian baru yang dicetak sty, piala asia u23 empat besar sejarah, sty bukan cuma pelatih tapi tidak akan bisa berpaling, jasa beliau di timnas banyak, dulu banyak yang tidak suka bola jadi suka, karena permainannya punya visi misi dan terbentuk", negative
"saya juga belum berpaling dari kekalahan timnas, keingat terus dan hari ini lemas sekali tidak mau ngapa ngapain. sedih sekali, tetapi walau kalah saya akan tetap cinta dan dukung timnas indonesia", positive
"jujur bener banget timnas adalah salah satu kebahagian yang kita miliki sebagai wni", positive
"jadikan pelajaran kedepannya, jujur kalo melihat kualitas timnas kita baik dari pemain sampai manajemen dan pelatihan saya rasa emang masih kurang. saya bahkan bakal menganggap kalo lolos itu mukjizat tapi kalo gagal maka ya tidak heran, maksud saya coba bandingin sama jepang atau eropa, jauh timnas kita buat bisa setara sama mereka, main masih loyo, umpan, oper kadang tidak sempurna, tembakan kalah-kalah. disempurnakan lagi, minimal bisa imbangi jepang disitu baru kita bisa yakin bisa lolos bahkan bukan tidak mungkin jadi juara.", negative
"sty paham fisik, mental dan karakter pemain indonesia, awal sty melatih fokus pada fisik dan mental, dan sudah jelas sty berpengalaman di banding si botak kelipet, erick , towel, jusktn orang yang merusak Indonesia beserta para mafia bola", negative
"240 juta laki-laki di indonesia menangis, murung, hampa, akibat kekalahan tim kebanggan kita bersama, karena ketika timnas bertanding di kualifikasi piala dunia itu pertandingan yang di nanti-nanti, tapi kita di buat kecewa oleh 1 orang, yaitu", negative
"ini kemarahan udah di ujung tanduk, gila kalo masih pertajanin kluivert. tidak ada malu kalo et masih menjabat ketua umum pssi dan menpora sekaligus.", negative
"dulu pernah ada yang bilang percaya proses tapi pas di tengah perjalanan pelatihnya di ganti jadi yang harus percaya proses tuh siapa? ibarat mau renovasi rumah tapi yang di hancurkan pertama adalah pondasinya, pasti ambruk semua proses yang di bangun dari minus itu", negative
"dari januari sejak berita pemecatan sty, saya sudah menyuarakan pesimisme dan kecewa dengan pssi. dan sekarang terbukti betapa blundernya keputusan et.", negative
"indonesia sudah bisa masuk kualifikasi piala dunia saja aku sudah bangga bang, saya sangat bangga dengan tim ini", positive
"pupus sudah harapan piala dunia. kecewa pak ericmk harus bertanggung jawab.", negative