comment, label
"pelatih sty yang diberhentikannya. kok kita yang sedih dan kecewanya ya, saya juga tidak mengerti dan tidak tertarik bola, tetapi sangat hormat dengan pelatih sty yang totalitas membawa negeri kita semelambung itu, benar kata om ded ""sty berhasil membawa kita ke mimpi yang bahkan kita nggak bermimpi. terima kasih banyak pelatih sty.... kita sangat menghormati anda", positive
"dari pelatih ganteng berwibawa sampe pemain ganteng-ganteng keren-keren, inilah era timnas di masa sty. terima kasih pelatih, semoga yang terbaik untuk anda", positive
"yang paling menyedihkan dari semua proses yang sudah berjalan sejauh ini adalah fans sepak bola di negara wakanda ini yang masih kekanak-kanakan atau tidak dewasa, sebagian sekedar fomo atau ikut-ikutan, taunya cuma hujat, nyinyir, dan hal negatif lainnya. lelah banget lihat komen-komen negatif, ayolah mari dukung saja dahulu, kita bisa koreksi atau evaluasi pssi nanti pada waktunya.", positive
"percaya mimpi perlu perjuangan dan pengorbanan. insyaallah pak et berjuang untuk itu. fokus kita dukung timnas.", positive
"jika komunikasi sudah bermasalah maka memang harus ada perombakan. saya setuju aja sama et, karena dia memang sudah memikirkan dengan matang. cukup dukung dan doakan karna et melakukan ini demi mimpi indonesia lolos piala dunia", positive
"hormat buat pelatih sty setingginya atas semua yang sudah dibangun dan sangat luar biasa, dilihat dari alasan pemecatan bukan mendadak tapi sudah melalui proses evaluasi panjang sejak pertandingan-pertandingan sebelumnya, sah saja orang memiliki opini berbeda tetapi, satu hal buat semua pecinta bola indonesia bersatulah demi kemajuan sepak bola bukan terlalu banyak omong kosong! timnas selamanya pelatih sementara jangan lupakan itu. pemain timnas itu pemain professional dimana mereka harus bisa adaptasi disetiap pertandingan dngan berbagai hal termasuk pelatih baru dan pemain baru, dukung saja mental pemain agar sesuai yang penonton harapkan! salam bola itu bundar! timnas bukan klub jayalah indonesiaku", positive
"apapun yang terjadi tetap dukung timnas, tanpa perlu menjatuhkan dan menyerang sty, pelatih sty dari awal melatih sampai selesai selalu mendapatkan serangan tanpa pernah sedikitpun sty membalasnya dan sty tidak pernah sedikitpun menjelek-jelekan orang-orang di indonesia", positive
"siapapun pelatihnya wajib kita dukung timnas", positive
"apapun langkah pssi dan pak et kedepan, kita harus dukung, dan semoga aja bisa lolos ke piala dunia dari kualifikasi babak ketiga ini", positive
"lihat saja masa suram akan kembali lagi. terima kasih sty telah membuat sejarah indonesia", negative
"yang pasti, sty sudah memberikan nilai yang sangat besar terhadap kemajuan timnas. semoga pelatih berikutnya bisa membuat timnas lebih bersinar lagi", positive
"untuk membawa timnas menuju level yang sekarang memang sty terbaik. semoga patrick bisa membawa garuda ke level yang lebih tinggi lagi. tetap dukung timnas", positive
"banyak omong sana sini. hujat sana sini. menurut kami itu tidak penting. jadilah warga yang baik. apapun keputusan pak erik. kita dukung sepenuhnya, pelatih sty tetap di hati kami, yang terbaik di timnas kita yang setuju jempolnya salam dari jawa timur", positive
"saya pendukung timnas dan pssi era bapak et saya selalu berpikir realistis karena saya suka sepakbola dan semua apa yang didebatkan terjawab saat interview dengan bapak et. hidup timnas dan pssi era bapak et", positive
"tim tetap dukung timnas siapapun pelatihnya", positive
"setuju bang sty sudah membawa sepak bola indonesia bagus", positive
"intinya selagi masih ada mafia berkeliaran di indonesia persepakbolaan indonesia tidak bakalan bener mau menyimpulkan alesan yang bertele-tele tetep aja pemenangnya si mafia terima kasih pelatih sty semoga sukses di negara lainnya", negative
"tipikal indonesia dari dulu itu adalah kalo sudah nemu pemimpin yang bagus dan indonesia sudah mulai ada peningkatan kualitas pasti pemimpinnya langsung di ganti (dari segala aspek)", negative
"apapun masalah yang terjadi dibalik itu semua ada batasan yang kita tidak harus tau. itu sama saja dengan aib yang disebarluaskan. tetap dukung timnas dan tetap dukung semuanya. terima kasih pelatih sty sudah membuat garuda terbang tinggi. semangat untuk pak erick membangun sepakbola negeri ini.", positive
"sekarang kita berpaling dan dukung timnas lagi seperti sebelum-sebelumnya. terima kasih kepada sty dan selamat bekerja kepada kluivert. hentikan narasi-narasi merusak seperti ingin timnas kalah karena dendam kepada pssi atas pemecatan sty, menyerang pemain timnas yang tidak mengucapkan selamat jalan kepada sty dan yang tidak mau nonton timnas lagi karena pelatihnya bukan sty. kita berpaling, timnas diatas semua itu", positive
"jangan digoreng terus, jangan di adu domba, jadilah komentator dengan suasana positif, yang penting dukung terus timnas indonesia karena bukti kita cinta tanah air dan bangsa", positive
"berkat sty tim garuda dapat berlaga merumput disegani dunia internasional.", positive
"kita percayakan sama federasi dan pak erik. saya yakin ini keputusan yang terbaik. untuk pemuja sty kalian semoga sadar dan ngerti ya. ini demi kebaikan timnas kita agar lebih baik lagi. ayo garuda indonesia terbang tinggi lagi", positive
"saya berharap sty berjuang dulu sampai lolos atau tidaknya ke pildun. pssi juga harus menghargai perjuangan sty saat ini yang bawa timnas kita sampai sejauh ini kemajuannya. kami pecinta timnas kecewa dengan keputusan ini", negative
"sudah ayo dukung timnas. terima kasih sty. ayo semangat dukung timnas indonesia dengan komposisi baru. garuda tetap di dadaku", positive
"belum tentu pelatih sekaliber dunia siapapun bisa membawa tim indonesia sampe selevel ini. terima kasih sty.", positive
"saat ini indonesia sedang sangat naik namanya, bukan hanya lewat sepakbola tapi juga lewat hal-hal lainnya, alip ba ta, cakra kan, alffy rev dan banyak hal-hal lainnya yang tidak bisa disebutkan satu persatu disini, pidato bapak presiden juga membuat mata dunia semakin terbelalak. bahasa indonesia juga sudah mendunia. semoga momen penggantian pelatih timnas sepakbola ini malah akan menambah laju harumnya nama indonesia di mata dunia", positive
"setelah mendengar penjelasan dari pak erick. saya setuju pelatih sty istirahat dan sampaikan terima kasih karena bagian dari sejarah juga beliau bawa garuda muda ke level lebih tinggi, namun dengan ada nya masalah komunikasi yang ada dengan pemain diaspora yang merupakan aset negara maka jalan terbaik demi timnas maka ada pelatih baru, apa salah nya kita berikan kesempatan bagi pelatih baru apalagi kita punya peluang ke piala dunia dengan ada nya pemain diaspora yang secara grade mewah harapan kami semoga garuda muda menuju piala dunia amin keputusan pssi sudah dibuat mari kita berpaling dari pelatih sty, pelatih baru harapan baru, dan peluang ke piala dunia ada dengan komposisi pemain yang ada, mari kita dukung jangan menghujat, jika tidak keberatan mari doakan semoga garuda menuju piala dunia", positive
"harusnya pak erick langsung bicara empat mata dari hati ke hati dengan sty kalau mau berhentikan sty. itulah adab dan budaya kita, jadi semua berakhir dengan mulus, tidak liar seperti sekarang ini", negative
"sty sudah membawa kita kemimpi yang bahkan kita tidak pernah bermimpi om ded emang best. semua butuh proses", positive
"jika kedepannya akan ada kegagalan yang terulang maka federasi harus bertanggung jawab kepada masyarakat indonesia, bukan hanya pengunduran diri aja harus bertanggung jawab segalanya.", negative
"terima kasih dari lubuk hati terdalam kepada pelatih sty, sudah membawa tim garuda ke titik ini. sehat selalu", positive
"baru tadi malam pak erick tohir klarifikasi di metro tv penjelasan dia bikin adem rakyat indonesia, maju terus pak erick saya dukung program bapak supaya timnas maju", positive
"pelatih sty, pelatih terbaik, saya hormati keputusan federasi dengan caranya demi indonesia juga. tetapi pelatih sty adalah sang pencetak sejarah pelatih hebat yang mampu membawa indonesia ke babak tiga kualifikasi", positive
"pemilihan kluivert menurut saya sudah tepat. 1. bsa berinteraksi langsung dgn pemain. 2. membawa dua assisten mumpuni pastoor dan lanzaat. 3. pemain keturunan lain yang dulu tidak tertarik sekarang menjadi tertarik karna adanya kluivert. salam hormat untuk pssi dan pak et", positive
"sebagai pecinta timnas apapun keputusan pssi itu mutlak, dan kita siap mendukung bukan menilai dia tepat atau kurang tepat, pokoknya percayakan saja apapun keputusan pssi dan harus dukung bos timnas", positive
"sangat disayangkan sty diganti soalnya beliau sudah membawa kita sampai saat ini, ini hal yang luar biasa aku pun merasa adil walaupun cara bermainnya tidak sebagus ketika luis mila tetapi beliau sudah membawa kita sampai saat ini dan aku berharap beliau diganti saat habis kualifikasi piala dunia tapi terlepas dari itu pasti pak erick yang tahu apa yang diputuskan dan sekarang kita harus dukung timnas siapapun pelatihnya", positive
"males udah nonton bola, karna yang bikin semangat nonton bola ya pak sty. nyesel tuh nanti yang pecat!", negative
"betul!""jika ini semua nantinya berantakan yah kau harus tanggung jawab lah, kan kau yang ambil keputusan ini."" setuju banget dengan statement ini", negative
"berlian tetaplah berlian,diantara banyaknya batu kerikil, maka dari itu berlian disingkirkan karena batu kerikil ingin dilihat sebagaimana berlian. sama seperti pelatih sty yang memang begitu dicintai dan dihormati oleh rakyat indonesia karena tanpa pamrihnya membangun timnas indonesia dari keterpurukan, terima kasih banyak pelatih sty, utk dedikasi dan kerja kerasmu selama ini untuk indonesia, semoga pelatih sty lebih sukses ditempat barunya nanti", positive
"gila sih emang resiko yang diambil oleh pak erick dan pssi, apalagi harus bayar kompensasi sampe puluhan milyar karena sty yang kontraknya masih sampe 2027 nanti, saya sebagai pendukung hanya bisa mendukung dan mendoakan yang terbaik buat timnas kita, bagaimana pun keputusan sudah dibuat tidak mungkin bisa diputar balik lagi.", positive
"mimpi rakyat indonesia sudah bangga melihat timnas sepak bola indonesia yang sudah maju pesat dari bawah ranking 174 dilatih oleh sty sampai 125 dan sudah masuk penyisihan putaran ketiga piala dunia dan terakhir menang dari arab menang 2-0 alasan sty dipecat pssi karena kalah dari china dan lain-lain tidak bisa bahasa indonesia, ribut di ruangan locker dan lain-lain. pssi blunder kalau mau pecat langsung saat kalah lawan china", negative
"saya dan suami saya (mantan timnas uae) saja tidak setuju pemecatan sty di posisi saat ini om ded moga dievaluasi ulang hingga kualifikasi piala dunia", negative
"saya cinta timnas dan saya cinta sty tetapi cinta sya lebih besar ke timnas daripada sty. apa pun itu mari kita dukung kalah menang tetap dukung, mau bagaimana pun sudah menjadi bubur dan waktu terus berjalan, semangat buat kedepan semoga timnas berjaya. terima kasih sty engkau adalah sejarah yang tak mungkin kita lupakan, dan selamat datang pelatih pk.", negative
"intinya pelatih sementara timnas selamanya! jadi kita sebagai pendukung timnas tugasnya cuma dukung timnas dalam keadaan apapun itu", positive
"tunggulah saja hasil nya. kalo koar-koar sekarang tau-tau nanti malah lebih baik, malu", negative
"inti nya sty  tetap di cintai seluruh indonesia", positive
"pak erick sudah ambil keputusan yang sangat tepat, karena didalam tubuh timnas saat itu ada konflik yang sangat membahayakan bagi kemajuan timnas, konflik antara sty dan mayoritas pemain diaspora. dan semua itu sudah dipikirkan oleh pak et, pak et lebih memilih mempertahankan keutuhan timas dan pemain daripada mempertahankan satu individu saja, jadilah terbuka dan cerdas, tolong", positive
"sty telah selesai, titik. timnas milik rakyat indonesia yang wajib kita dukung,", positive
"sty itu ibarat magnet yang bisa memikat semua orang mau perempuan, anak-anak, ibu-ibu untuk mengikuti perkembangan sepakbola", positive
"siapa pun pelatihnya sy tetap dukung. yang terbaik untuk timnas", positive
"sudahlah, dukung timnas saja, mau apapun kondisinya. sty sudah berlalu, kita menghargai jasa-jasanya, ingat ketua umum kita bukan orang sembarangan.", positive
"saya pendukung timnas bukan pendukung sty apapun keputusan pssi saya terima itu hak pssi demi timnas, siapapun pelatihnya saya tetap dukung timnas", positive
"pak et ketua umum terbaik pssi terima kasih banyak pelatih sty ayo terbang tinggi timnas garuda indonesia", positive
"tidak paham lagi sama pak erik sama pssi, tidak paham", negative
"memang di pertandingan-pertandingan terakhir pssi, memang sangat menngecewakan hasilnya.", negative
"terima kasih sty selamat datang patrick udah segitu aja, tetap dukung timnas", positive
"terima kasih sty, disini saya dukung full pak erick, kita diluar tidak tahu apa yang terjadi, yang jelas sekarang dukung pelatih baru dengan target baru lolos piala dunia, amin", positive
"terima kasih pelatih sty sudah membawa timnas sampai ke level seperti sekarang. semoga pelatih semakin sukses diluar sana", positive
"mau bagaimana pun hasil tetep dukung timnas semoga tergantikannya sty bisa lebih baik lagi", positive
"terima kasih pelatih sty", positive
"di hati kami pecinta sepakbola (timnas) pelatih sty tetap dihati, terima kasih pelatih sty kamu adalah penyebab bangkitnya timnas indonesia", positive
"buat kami siapapun pelatih nya tidak masalah. yang penting pelatih tersebut bisa membawa timnas indonesia lolos ke piala dunia. syukur-syukur bisa juara dunia.", positive
"kami tetap mendukung timnas dan pssi", positive
"sty berterima kasih, pssi masih berusaha menjelekan, dari sini kita bisa nilai", positive
"semangat timnas, apapun yang terjadi kita akan tetap garuda", positive
"saya berharap sty makin semangat untuk menjadi pelatih walaupun bukan untuk indonesia, semoga saja didikan sty nantinya bisa bertemu di liga besar melawan indonesia dan mempermalukan timnas indonesia dengan skor yang sangat-sangat telak. amin", positive
"saya tetap dukung timnas. terima kasih sty selamat datang patrick", positive
"kalo dari saya sangat tepat. karena siapapun pelatihnya yang sudah dipilih saat ini itu pasti yang terbaik untuk kita semua dan terima kasih juga untuk sty atas dedikasi dan kerja kerasnya untuk timnas saat masih menjadi pelatih", positive
"sudalah gk usah begini begitu. yang penting pelatih sty udah memberikan yang terbaik yang penting mari kita lihat kedepan nya kita mendoakan yang terbaik untuk timnas", positive
"thanks you pelatih sty, aku mencintaimu dan selamat jalan", positive
"namanya akan tetep diceritakan samapai ke anak cucu nanti bahwa pernah ada pelatih dengan generasi hebatnha yang membanggakan timnas kita", positive
"kalo masalah bahasa mungkin, kluvert sama-sama dari belanda jadi masuk akal juga kalo pake kluivert. supaya komunikasi yang lancar", positive
"sty itu adalah matahari dan karisma sepak bola timnas indonesia, sty itu sudah menyatu dihati para pendukung sepak bola timnas indonesia", positive
"sampai kapanmu apabila nanti timnas benar masuk piala dunia atau menang di ajang lain yang harum tetap nama sty yang diteriaki pasti nama sty", positive
"terima kasih sty. bapak telah menanamkan standar sepak bola indonesia menuju 2045.", positive
"mengikuti sepak bola khususnya timnas dari jaman alfred riedl sampai sekarang, saya rasa jaman sty lah yang paling bagus tapi saya berharap semoga pelatih yang baru bisa lebih baik lagi", positive
"indonesia sulit menjadi negara yang besar dari segi prestasi karena tidak menghargai proses dan maunya instan. pola pikir instan yang dimiliki para pejabat kita yang buat indonesia selalu jalan di tempat.", negative
"kapan sepak bola indonesia bisa maju ,ini pasti ada tekanan entah siapa mereka", negative
"aku setuju dengan om ded si, karena dari kedatangan sty saat kondisi sepak bola korat karit sampai sekarang yang sangat sangat sangat luar biasa majunya yang bahkan kita tidak sampai kepikiran untuk maju ke piala dunia. itu saya sebagai seorang wanita yang tidak paham bola sangat menyayangkan sty diberhentikan", negative
"semoga pak ketua umum tidak salah ambil keputusan dengan memecat sty. dan semoga pelatih yang baru bisa mengangkat nama indonesia lebih baik.", positive
"saya kira keputusan et dan pssi sudah direncanakan dari jauh-jauh hari. karena tidak mungkin rekrut pelatih dan perangkatnya dalam waktu sehari", positive
"iya bos. menurut pemikiran orang awam. kalau pemikiran orang jenius memang harus diganti sebelum ada penyesalan. bagi kamu yang menilai selaku penonton bola. sty udah terlalu leluasa atas kekuasaan. pikir sendirilah, tidak mungkin saudara tidak tau", negative
"tim nas indonesia tanpa pelatih sty bagaikan minum kopi tidak ada gula, pahit rasanya. sejarah timnas sepanjang masa yaitu sty. beliau telah membawa timnas kita kemimpi besar,", positive
"belajarlah menghargai setiap orang. setiap pelatih tentu memiliki komitmen yang sangat positif yakni ingin memberi yang terbaik. tunggu saja hasil kinerjanya bos.", positive
"sekarang sudah ganti pelatih, tinggal tatap kedepan selalu dukung timnas", positive
"banyak konflik internal ,mungkin cara terbaik yang di ambil adalah mengganti pelatih walaupun itu berat dan terkesan menurunkan di tengah jalan", positive
"penjelasan pak erick bisa menjawab semua informasi liar dan pengamatan kita. walau pro kontra dan dinamika di pencinta sepak bola adalah wajar karena kecintaan kita kepada sepak bola indonesia. bravo sepak bola indonesia.", positive
"sumpah saya kecewa banget sty diganti", negative
"terima kasih untuk sty", positive
"memang naturalisasi adalah jalan pintas, dan para pemain naturalisasi pun juga bagian dari indonesia dan berjuang untuk indonesia. tapi alangkah bangganya jika semua di lakukan dari anak bangsa. papua punya para bakal pemain dengan fisik nomor satu.", positive
"pak erick melihat momentum dan nilai masa depan makanya di ganti dan itu sangat tepat sekali", positive
"butuh waktu untuk adaptasi untuk pelatih dan pemain dan ini di berhentikan dalam posisi yang nanggung tinggal tiga kali pertandingan dan kalau di evaluasi nanti setelah target selesai.", negative
"pelatih sty terbaik", positive
"menurut saya bukan sty nya , tetapi kalian harus sadar semua ini terjadi karena pemain diaspora", negative
"terlepas dari semua polemik yang ada, kita peduli dan berterima kasih ke sty karna sudah membawa timnas sampai detik ini, untuk kedepan kita tetap harus dukung pssi, timnas dan pelatih baru.", positive
"semoga netizen netizen yang pintar dan budiman lebih bijak lagi dalam komentar , ketauan sekali tidak bersyukur nya intinya sty bisa membawa timnas ke mimpi yang tidak pernah di bayangkan", positive
"terima kasih banyak pelatih sty, selamat datang pk, ap, dl", positive
"jangan banyak bicara ketua umum pssi lebih tau apa yang terjadi diruang ganti daripada saya sendiri dan mereka bertiga.", negative
"yang punya indonesia adalah rakyat indonesia kawal federasi maka kita awasi kepentingan-kepentingan pribadi atau kelompok dalam instansi.", negative
"saya masih tidak ikhlas pelatih sty pergi sedih", negative
"bung towel pun bahagia atas berita pemecatan sty", negative
"ujung-ujungnya karena ada faktor perpolitikan di organisasi", negative
"masih sedih dan kesel liat pk itu loh gue, sty saya mencintai kalian", negative
"alasan utama kek nya karena buru-buru ini indonesia punya kerjasama sepakbola dengan belanda, dan tekanan dari belanda supaya pake pelatih dari belanda untuk timnas dalam usaha mewujudkan salah satu bentuk kerjasama nya", negative
"sty sudah menjadi magnet bagi pendukung indonesia", positive
"aku tidak terlalu tau bola tapi menurut ku sty bagus loh bisa membawa mimpi masyarakat indonesia jadi nyata dan hampir ke piala dunia", positive
"pelatih yang gantikan sty adalah tamparan besar untuk timnas indonesia", negative
"sty sudah banyak berjasa pada timnas selama ini", positive
"pelatih sty datang sebagai professional dan pulang sebagai pahlawan", positive
"sudahlah, cukup tonton, nikmati, sambil ngopi mudah-mudahan kita tidak bermimpi", positive
"sty sudah sangat baik, kelas asia sudah. sekarang fokus kelas dunia. rasanya butuh perubahan yang terutama yaitu komunikasi..", positive
"kalok sty bawa timnas sampe saat ini dengan pemain lokal boleh lah dipertahankan", negative
"sederhana, kalo ingin memenangkan hati fans timnas. buktikan di dua laga di maret besok.", negative
"baru kali ini saya sedih karna bola padahal saya tidak pernah mengikuti perbolaan Indonesia. saya lihat-lihat sty tulus sekali orangnya. sialan", negative
"apapun keputusan pssi harus kita dukung, baik buruk adalah resikonya. setuju atau tidak hak masing-masing, dan untuk para pengamat harusnyah kalian bersikap netral karena sebagai publik pigur apapun ucapan kalian akan berpengaruh bagi masyarakat. selamat tinggal pelatih sty terima kasih. jasamu akan selalu terkenang. selamat datang pelatih patrick semoga kamu bisa mewujudkan mimpi indonesia menuju piala dunia", positive
"terima kasih sty karena telah berhasil membawa timnas sampai seperti saat ini walaupun pulangnya tidak diantar. selamat datang pelatih baru patrick kedatanganmu disambut dengan karpet merah dengan siaran live dibeberapa tv hanya pulangnya nanti apakah dengan karpet merah juga atau senyap tidak diantar seperti sty kita lihat aja nanti semoga sesuai harapan pencinta sepak bola indonesia", positive
"sty sudah membawa timnas ke detik ini udah bagus sekali terimakasih. tetapi bagus juga untuk pssi berati kerja ada tim analis kalau hasil tidak bagus terus tidak berani ambil tindakan yang berarti percuma tim analis dll", positive
"sering mengganti pelatih udah wajar kali pak erick tohir bukan anak kemarin di dunia sepak bola.", positive
"timnas kita tuh perlu kemajuan kalo misalkan sty jadi pelatih timnas terus kapan mau maju timnas kita, undang sih oki lagi sih paling tau bola timnas", negative
"tolong sampaikan salam untuk sty om ded, dia salah satu pelatih berjasa bagi kemajuan sepak bola timnas.", positive
"sty masih tetap dihati", positive
"menurut saya jangan disamakan federasi dengan perusahaan, langkah pak erick yang sekarang adalah menyelamatkan tim dengan cara meniru tim-tim besar di eropa, secara komposisi pemain timnas sudah bagus, belum lagi yang akan datang, dengan suasana antara pemain dan pelatih kurang harmonis, maka disitu harus ada yang dikorbankan, disini pak erick mengorbankan sty, karena jangan sampai seperti tim-tim di eropa, semua pemain lebih memilih kalah agar pelatih segera diganti", positive
"tidak masalah sty keluar asalkan jangan pak et keluar, tetap dukung program pak et untuk indonesia terbang lebih tinggi lagi di kancah dunia", positive
"setuju nggak setuju sudah di ganti sty mari kita dukung PSSI untuk mewujudkan kita lolos ke babak selanjutnya ayo semangat", positive
"ini konten yang membuat timnas kacau. ngapain kita yangg atur biar pak erick yang ambil keputusan. semakin kacau timnas kita. nilai diri kita sendiri dulu. siapa kita itu aja kuncinya", negative
"pak erick emang ketua pssi paling mantap", positive
"ambil yang jelek, buang yang bagus. seperti itu", positive
"saya yang penting timnas berprestasi kedepannya siapapun pelatihnya", positive
"tapi ini sama-sama blasteran indonesia belanda pasti sang pelatih baru sudah paham dan yangg di latih juga cepat bisa memahami", positive
"baru ini sumpah sampai nangisin pelatih sty, dedikasi nya pelatih sty ni benar-benar terasa di hati masyarakat indonesia makanya bisa sampai sesayang ini masyarakat indonesia dan bisa sekehilangan ini pelatih sty di pecat", negative
"udah percaya dan yakin lolos ke piala dunia bersama sty eh malah dipecat", negative
"kok sampai detik ini masih ok, lihat lawan cina timnas jelas-jelas blunder. pemain yangg di salahkan atau pelatih? terus di rujang ganti ada dinamika komunikasi dan yangg jelas gaya main sty parkir bis buat sesak dada penonton.", negative
"kami rindu sty", positive
"saya sepakat dibawah coach justin timnas akan terbang tinggi mendunia", positive
"emang bener sty membawa indonesia sejauh ini, tetapi sepertinya pssi ingin indonesia melangkah jauh, dan sty emang tidak akan bisa melaju lebih jauh, karena dia egoisnya tinggi, tidak mau menerima masukan orang, kalo kesinggung gampang coret pemain padahal itu membuat tim jadi pincang", negative
"kita liat saja nanti laga selanjutnya jika perubahaan lebih baik maka tidak ada salah nya tapi jika perfoma malah turun maka kita patut menyesali sty keluar", negative
"yang tidak baik justru federasi dari dulu memang begitu banyak yang iri dengan sty", negative
"memang daya tangkap tiap orang itu tidak sama. saya hanya penggemar bola biasa, tapi setelah mendengar penjelasan et seputar pemecatan sty saya langsung paham. dan masuk akal dan memang mendasar sekali alasannya tuh.", positive
"terima kasih sty tetapi kita tetap harus mendukung pelatih pengganti. karena tujuan kita sama. percuma juga kalau tidak setuju kalau diganti", positive
"kemajuan bola indonesia sudah maju semenjak ada sty, wajar mereka marah ketika di ganti di tengah debut kualifikasi", positive
"ayo dilaga melawan bahrain nanti di gbk kembangkan foto sty dengan kata terima kasih itu bentuk apresiasi sih", positive
"perubahan selalu ada konflik dan ini wujud yang nyata di timnas. fenomena panggung depan dan panggung belakang sangat unit dan besar dinamikanya, sampai pak erick seakan kurang enak untuk langsung berbicara dengan sty soal pemberhentiannya. pak erick orang yang baik, tetapi dinamika sty ini bisa disebut ada dinamika panggung depan dan panggung belakang. dinamika panggung depan terlihat baik-baik saja dan pendukung merasa senang. tidak baik bagi beberapa pengamat. di panggung belakang?", negative
